{
  "schema_version": "review-target-declaration/1.0",
  "confirmed_by": "author",
  "confirmed_at": "2026-08-24T12:00:00+08:00",
  "criteria_as_of": "2026-08-24",
  "discipline": {
    "primary": "Software Engineering",
    "subfield": "Mining Software Repositories",
    "additional_disciplines": []
  },
  "target": {
    "venue": "MSR 2027",
    "track": "Technical Papers",
    "contribution_type": "Full Paper"
  },
  "reporting_design_overlays": ["ACM SIGSOFT Repository Mining Standard"],
  "criterion_selection": {"mode": "all_applicable", "ids": []},
  "precedence": [
    {"rank": 1, "authority_class": "official_venue_type"},
    {"rank": 2, "authority_class": "field_society_standard"},
    {"rank": 3, "authority_class": "reporting_design_overlay"},
    {"rank": 4, "authority_class": "broad_field_fallback"}
  ]
}
